{
    "$schema": "./bus_schema.json",
    "name": "Prutace",
    "line_number": "9",
    "services": 18,
    "regular_services": [
        1,
        3,
        6,
        9,
        13,
        18
    ],
    "irregular_services": [
        2,
        4,
        5,
        7,
        8,
        10,
        11,
        12,
        14,
        15,
        16,
        17
    ],
    "regular_explanation": "Polasci pod brojevima 1,3,6, 9, 13, 18 saobraćaju svakodnevno",
    "irregular_explanation": "Polasci pod brojevima 2,4,5,7,8,10,11,12,14,15,16,17 saobraćaju samo radnim danima",
    "stops": [
        {
            "name": "Maoča Badarka",
            "times": [
                "06:00",
                "06:30",
                "07:00",
                "07:30",
                "08:00",
                "10:00",
                "11:00",
                "11:30",
                "12:00",
                "12:30",
                "13:00",
                "13:30",
                "15:00",
                "16:00",
                "17:30",
                "18:00",
                "19:00",
                "20:00"
            ]
        },
        {
            "name": "Maoča Centar",
            "times": [
                "06:01",
                "06:31",
                "07:01",
                "07:31",
                "08:01",
                "10:01",
                "11:01",
                "11:31",
                "12:01",
                "12:31",
                "13:01",
                "13:31",
                "15:01",
                "16:01",
                "17:31",
                "18:01",
                "19:01",
                "20:01"
            ]
        },
        {
            "name": "govno",
            "times": [
                "06:00",
                "06:30",
                "07:00",
                "07:30",
                "08:00",
                "10:00",
                "11:00",
                "11:30",
                "12:00",
                "12:30",
                "13:00",
                "13:30",
                "15:00",
                "16:00",
                "17:30",
                "18:00",
                "19:00",
                "20:00"
            ]
        }
    ]
}