{
    "$schema": "./bus_schema.json",
    "name": "Bolnica - Satorovići",
    "line_number": "3",
    "services": 6,
    "regular_services": [
        7,
        8,
        9,
        10,
        11,
        12
    ],
    "irregular_services": [],
    "regular_explanation": "Polasci pod brojevima 7, 8, 9, 10, 11, 12 saobraćaju svakodnevno",
    "irregular_explanation": "",
    "stops": [
        {
            "name": "BOLNICA",
            "times": [
                "06:30",
                "11:00",
                "13:25",
                "16:30",
                "18:16",
                "19:26"
            ]
        },
        {
            "name": "DOM ZDRAVLJA",
            "times": [
                "06:31",
                "11:01",
                "13:26",
                "16:31",
                "18:17",
                "19:27"
            ]
        },
        {
            "name": "Kolobara",
            "times": [
                "06:32",
                "11:02",
                "13:27",
                "16:32",
                "18:18",
                "19:28"
            ]
        },
        {
            "name": "Robna kuća",
            "times": [
                "06:33",
                "11:03",
                "13:28",
                "16:33",
                "18:19",
                "19:29"
            ]
        },
        {
            "name": "Soliter",
            "times": [
                "06:34",
                "11:04",
                "13:29",
                "16:34",
                "18:20",
                "19:30"
            ]
        },
        {
            "name": "Grčica Crkva",
            "times": [
                "06:35",
                "11:05",
                "13:30",
                "16:35",
                "18:21",
                "19:31"
            ]
        },
        {
            "name": "Grčica I",
            "times": [
                "06:36",
                "11:06",
                "13:31",
                "16:36",
                "18:22",
                "19:32"
            ]
        },
        {
            "name": "Farma",
            "times": [
                "06:38",
                "11:08",
                "13:33",
                "16:38",
                "18:24",
                "19:34"
            ]
        },
        {
            "name": "Seljanka (Škola)",
            "times": [
                "06:39",
                "11:09",
                "13:34",
                "16:39",
                "18:25",
                "19:35"
            ]
        },
        {
            "name": "Potočari Crkva",
            "times": [
                "06:40",
                "11:10",
                "13:35",
                "16:40",
                "18:26",
                "19:36"
            ]
        },
        {
            "name": "Potočari I",
            "times": [
                "06:41",
                "11:11",
                "13:36",
                "16:41",
                "18:27",
                "19:37"
            ]
        },
        {
            "name": "Potočari II",
            "times": [
                "06:43",
                "11:13",
                "13:38",
                "16:43",
                "18:29",
                "19:39"
            ]
        },
        {
            "name": "Potočari III",
            "times": [
                "06:47",
                "11:17",
                "13:42",
                "16:47",
                "18:33",
                "19:43"
            ]
        },
        {
            "name": "Trešnjica",
            "times": [
                "06:51",
                "11:21",
                "13:46",
                "16:51",
                "18:37",
                "19:47"
            ]
        },
        {
            "name": "Dubravice D. (R)",
            "times": [
                "06:54",
                "11:24",
                "13:49",
                "16:54",
                "18:40",
                "19:50"
            ]
        },
        {
            "name": "Miladije",
            "times": [
                "06:58",
                "11:28",
                "13:53",
                "16:58",
                "18:44",
                "19:54"
            ]
        },
        {
            "name": "Dubravice II",
            "times": [
                "07:01",
                "11:31",
                "13:56",
                "17:01",
                "18:47",
                "19:57"
            ]
        },
        {
            "name": "Dubravice I",
            "times": [
                "07:03",
                "11:33",
                "13:58",
                "17:03",
                "18:49",
                "19:59"
            ]
        },
        {
            "name": "Satorovići I",
            "times": [
                "07:07",
                "11:37",
                "14:02",
                "17:07",
                "",
                "20:03"
            ]
        },
        {
            "name": "SATOROVIĆI",
            "times": [
                "07:09",
                "11:39",
                "14:04",
                "17:09",
                "",
                "20:05"
            ]
        }
    ]
}