{
    "$schema": "./bus_schema.json",
    "name": "Posavci - Bolnica",
    "line_number": "3",
    "services": 5,
    "regular_services": [
        1,
        3,
        4,
        5
    ],
    "irregular_services": [
        2
    ],
    "regular_explanation": "Polasci pod brojevima 1, 3, 4, 5 saobraćaju svakodnevno",
    "irregular_explanation": "Polasci pod brojem 2 ne saobraćaju subotom, nedjeljom i praznikom",
    "stops": [
        {
            "name": "POSAVCI",
            "times": [
                "05:40",
                "07:10",
                "11:40",
                "14:20",
                "16:30"
            ]
        },
        {
            "name": "Ražljevo",
            "times": [
                "05:45",
                "07:15",
                "11:45",
                "14:25",
                "16:35"
            ]
        },
        {
            "name": "Popovo p. (R)",
            "times": [
                "05:48",
                "",
                "11:48",
                "14:28",
                ""
            ]
        },
        {
            "name": "Popovo polje",
            "times": [
                "05:50",
                "",
                "11:50",
                "14:30",
                ""
            ]
        },
        {
            "name": "Popovo (R)",
            "times": [
                "05:52",
                "",
                "11:52",
                "14:32",
                ""
            ]
        },
        {
            "name": "Ražljevo",
            "times": [
                "05:55",
                "07:15",
                "11:55",
                "14:35",
                "16:35"
            ]
        },
        {
            "name": "Krbeti",
            "times": [
                "06:00",
                "07:20",
                "12:00",
                "14:40",
                "16:40"
            ]
        },
        {
            "name": "Sandići",
            "times": [
                "06:03",
                "07:23",
                "12:03",
                "14:43",
                "16:43"
            ]
        },
        {
            "name": "Buzekara",
            "times": [
                "06:06",
                "07:26",
                "12:06",
                "14:46",
                "16:46"
            ]
        },
        {
            "name": "Jasika",
            "times": [
                "06:09",
                "07:29",
                "12:09",
                "14:49",
                "16:49"
            ]
        },
        {
            "name": "Stanovi",
            "times": [
                "06:12",
                "07:32",
                "12:12",
                "14:52",
                "16:52"
            ]
        },
        {
            "name": "Takiša",
            "times": [
                "06:17",
                "07:37",
                "12:17",
                "14:57",
                "16:57"
            ]
        },
        {
            "name": "Brezik Dom",
            "times": [
                "06:19",
                "07:39",
                "12:19",
                "14:59",
                "16:59"
            ]
        },
        {
            "name": "Brezik I",
            "times": [
                "06:20",
                "07:40",
                "12:20",
                "15:00",
                "17:00"
            ]
        },
        {
            "name": "Brezik R.",
            "times": [
                "06:21",
                "07:41",
                "12:21",
                "15:01",
                "17:01"
            ]
        },
        {
            "name": "Seljanka(Škola)",
            "times": [
                "06:22",
                "07:42",
                "12:22",
                "15:02",
                "17:02"
            ]
        },
        {
            "name": "Farma",
            "times": [
                "06:23",
                "07:43",
                "12:23",
                "15:03",
                "17:03"
            ]
        },
        {
            "name": "Grčica II",
            "times": [
                "06:24",
                "07:44",
                "12:24",
                "15:04",
                "17:04"
            ]
        },
        {
            "name": "Grčica I (Crkva)",
            "times": [
                "06:25",
                "07:45",
                "12:25",
                "15:05",
                "17:05"
            ]
        },
        {
            "name": "Vet.Stanica",
            "times": [
                "06:26",
                "07:46",
                "12:26",
                "15:06",
                "17:06"
            ]
        },
        {
            "name": "Robna kuća",
            "times": [
                "06:27",
                "07:47",
                "12:27",
                "15:07",
                "17:07"
            ]
        },
        {
            "name": "Kolobara",
            "times": [
                "06:28",
                "07:48",
                "12:28",
                "15:08",
                "17:08"
            ]
        },
        {
            "name": "Dom zdravlja",
            "times": [
                "06:29",
                "07:49",
                "12:29",
                "15:09",
                "17:09"
            ]
        },
        {
            "name": "BOLNICA",
            "times": [
                "06:30",
                "07:50",
                "12:30",
                "15:10",
                "17:10"
            ]
        }
    ]
}