{
    "$schema": "./bus_schema.json",
    "name": "Bolnica - Novo Naselje",
    "line_number": "1",
    "services": 5,
    "regular_services": [
        1,
        2,
        3,
        4,
        5
    ],
    "irregular_services": [],
    "regular_explanation": "Polasci pod brojevima 1,2,3,4,5 saobraćaju svakodnevno",
    "irregular_explanation": "",
    "stops": [
        {
            "name": "Bolnica",
            "times": [
                "06:30",
                "10:25",
                "13:35",
                "16:35",
                "19:25"
            ]
        },
        {
            "name": "Dom Zdravlja",
            "times": [
                "06:31",
                "10:26",
                "13:36",
                "16:36",
                "19:26"
            ]
        },
        {
            "name": "Kolobara",
            "times": [
                "06:32",
                "10:27",
                "13:37",
                "16:37",
                "19:27"
            ]
        },
        {
            "name": "Centar",
            "times": [
                "06:33",
                "10:28",
                "13:38",
                "16:38",
                "19:28"
            ]
        },
        {
            "name": "Šumarija",
            "times": [
                "06:34",
                "10:29",
                "13:39",
                "16:39",
                "19:29"
            ]
        },
        {
            "name": "Uljarica",
            "times": [
                "06:35",
                "10:30",
                "13:40",
                "16:40",
                "19:30"
            ]
        },
        {
            "name": "Bosnaprod",
            "times": [
                "06:36",
                "10:31",
                "13:41",
                "16:41",
                "19:31"
            ]
        },
        {
            "name": "Farma",
            "times": [
                "06:37",
                "10:32",
                "13:42",
                "16:42",
                "19:32"
            ]
        },
        {
            "name": "Blizna",
            "times": [
                "06:38",
                "10:33",
                "13:43",
                "16:43",
                "19:33"
            ]
        },
        {
            "name": "Brezik R.",
            "times": [
                "06:39",
                "10:34",
                "13:44",
                "16:44",
                "19:34"
            ]
        },
        {
            "name": "Stolin",
            "times": [
                "06:40",
                "10:35",
                "13:45",
                "16:45",
                "19:35"
            ]
        },
        {
            "name": "Pirometali",
            "times": [
                "06:41",
                "10:36",
                "13:46",
                "16:46",
                "19:36"
            ]
        },
        {
            "name": "Gredice II (R)",
            "times": [
                "06:43",
                "10:38",
                "13:48",
                "16:48",
                "19:38"
            ]
        },
        {
            "name": "Gredice (R)",
            "times": [
                "06:45",
                "10:40",
                "13:50",
                "16:50",
                "19:40"
            ]
        },
        {
            "name": "Sandići (R)",
            "times": [
                "06:46",
                "10:41",
                "13:51",
                "16:51",
                "19:41"
            ]
        },
        {
            "name": "Trnjaci (R)",
            "times": [
                "06:49",
                "10:44",
                "13:54",
                "16:54",
                "19:44"
            ]
        },
        {
            "name": "S.B. Polje (R)",
            "times": [
                "06:50",
                "10:45",
                "13:55",
                "16:55",
                "19:45"
            ]
        },
        {
            "name": "S.B. Polje igralište",
            "times": [
                "",
                "",
                "",
                "19:46",
                ""
            ]
        },
        {
            "name": "S.B. Polje igralište",
            "times": [
                "",
                "",
                "",
                "19:47",
                ""
            ]
        },
        {
            "name": "S.B. Polje igralište",
            "times": [
                "",
                "",
                "",
                "19:48",
                ""
            ]
        },
        {
            "name": "S.B. Polje (R)",
            "times": [
                "",
                "",
                "",
                "19:49",
                ""
            ]
        },
        {
            "name": "B. Polje",
            "times": [
                "06:55",
                "10:50",
                "14:00",
                "17:00",
                "19:50"
            ]
        },
        {
            "name": "Novo Naselje",
            "times": [
                "06:58",
                "10:53",
                "14:03",
                "17:03",
                "19:53"
            ]
        }
    ]
}