{
    "$schema": "./bus_schema.json",
    "name": "Vučilovac - Marković Polje",
    "line_number": "2",
    "services": 7,
    "regular_services": [
        3,
        6,
        7
    ],
    "irregular_services": [
        1,
        2,
        4,
        5
    ],
    "regular_explanation": "Polasci pod brojem 3, 6, 7 saobraćaju svakodnevno",
    "irregular_explanation": "Polasci pod brojem 1, 2, 4, 5 ne saobraćaju subotom, nedjeljom i praznikom",
    "stops": [
        {
            "name": "VUČILOVAC",
            "times": [
                "05:55",
                "06:04",
                "09:00",
                "—",
                "—",
                "—",
                "—"
            ]
        },
        {
            "name": "Čišva",
            "times": [
                "—",
                "—",
                "09:06",
                "—",
                "—",
                "—",
                "—"
            ]
        },
        {
            "name": "Krepšić Pošta",
            "times": [
                "—",
                "—",
                "09:15",
                "—",
                "—",
                "—",
                "—"
            ]
        },
        {
            "name": "Krepšić Škola",
            "times": [
                "—",
                "—",
                "—",
                "11:05",
                "12:00",
                "14:00",
                "17:30"
            ]
        },
        {
            "name": "M. POLJE",
            "times": [
                "—",
                "07:00",
                "—",
                "11:07",
                "12:02",
                "14:02",
                "17:32"
            ]
        },
        {
            "name": "Krepšić Škola",
            "times": [
                "—",
                "07:02",
                "—",
                "11:08",
                "12:03",
                "14:03",
                "17:33"
            ]
        },
        {
            "name": "Krepšić Pošta",
            "times": [
                "—",
                "07:03",
                "—",
                "—",
                "—",
                "—",
                "—"
            ]
        },
        {
            "name": "Vučilovac-Čišva",
            "times": [
                "—",
                "—",
                "—",
                "—",
                "—",
                "—",
                "—"
            ]
        },
        {
            "name": "Krepšić Pošta",
            "times": [
                "—",
                "—",
                "—",
                "—",
                "—",
                "—",
                "—"
            ]
        },
        {
            "name": "Gorice",
            "times": [
                "06:13",
                "07:06",
                "09:18",
                "11:11",
                "12:06",
                "14:06",
                "17:36"
            ]
        },
        {
            "name": "Timko",
            "times": [
                "06:15",
                "07:08",
                "09:20",
                "11:13",
                "12:08",
                "14:08",
                "17:38"
            ]
        },
        {
            "name": "Slankara",
            "times": [
                "06:18",
                "07:11",
                "09:23",
                "11:16",
                "12:11",
                "14:11",
                "17:41"
            ]
        },
        {
            "name": "Grbavica (R)",
            "times": [
                "06:20",
                "07:13",
                "09:25",
                "11:18",
                "12:13",
                "14:13",
                "17:43"
            ]
        },
        {
            "name": "Ulički put",
            "times": [
                "06:22",
                "07:15",
                "09:27",
                "11:20",
                "12:15",
                "14:15",
                "17:45"
            ]
        },
        {
            "name": "Grbavica škola",
            "times": [
                "—",
                "07:18",
                "—",
                "11:23",
                "12:18",
                "—",
                "—"
            ]
        },
        {
            "name": "Ulički put",
            "times": [
                "—",
                "07:21",
                "—",
                "—",
                "12:21",
                "—",
                "—"
            ]
        },
        {
            "name": "Antunović p.",
            "times": [
                "06:25",
                "07:24",
                "09:30",
                "—",
                "12:24",
                "14:18",
                "17:48"
            ]
        },
        {
            "name": "PSC",
            "times": [
                "06:26",
                "07:25",
                "09:31",
                "—",
                "12:25",
                "14:19",
                "17:49"
            ]
        },
        {
            "name": "Bolnica",
            "times": [
                "06:27",
                "07:26",
                "09:32",
                "—",
                "12:26",
                "14:20",
                "17:50"
            ]
        },
        {
            "name": "D. Zdravlja",
            "times": [
                "06:28",
                "07:27",
                "09:33",
                "—",
                "12:27",
                "14:21",
                "17:51"
            ]
        },
        {
            "name": "Kolobara",
            "times": [
                "06:30",
                "07:29",
                "09:35",
                "—",
                "12:29",
                "14:23",
                "17:53"
            ]
        },
        {
            "name": "Centar",
            "times": [
                "06:32",
                "07:31",
                "09:37",
                "—",
                "12:31",
                "14:25",
                "17:55"
            ]
        },
        {
            "name": "Vet.stanica",
            "times": [
                "—",
                "07:34",
                "09:40",
                "—",
                "12:34",
                "14:28",
                "17:58"
            ]
        },
        {
            "name": "Greica I",
            "times": [
                "—",
                "07:35",
                "09:41",
                "—",
                "12:35",
                "14:29",
                "17:59"
            ]
        },
        {
            "name": "Greica II",
            "times": [
                "—",
                "07:36",
                "09:42",
                "—",
                "12:36",
                "14:30",
                "18:00"
            ]
        },
        {
            "name": "Farma",
            "times": [
                "—",
                "07:37",
                "09:43",
                "—",
                "12:37",
                "14:31",
                "18:01"
            ]
        },
        {
            "name": "Seljanka",
            "times": [
                "—",
                "07:38",
                "09:44",
                "—",
                "12:38",
                "14:32",
                "18:02"
            ]
        },
        {
            "name": "Brezik raskr.",
            "times": [
                "—",
                "07:39",
                "09:45",
                "—",
                "12:39",
                "14:33",
                "18:03"
            ]
        },
        {
            "name": "Brezik crkva",
            "times": [
                "—",
                "07:40",
                "09:46",
                "—",
                "12:40",
                "14:34",
                "18:04"
            ]
        },
        {
            "name": "Potočari I",
            "times": [
                "—",
                "07:41",
                "09:47",
                "—",
                "12:41",
                "14:35",
                "18:05"
            ]
        },
        {
            "name": "POTOČARI II",
            "times": [
                "—",
                "07:43",
                "09:49",
                "—",
                "12:43",
                "14:37",
                "18:07"
            ]
        }
    ]
}